article_id,content_type,title,published_date,published_year,published_month,excerpt,article_text,source_url,image_url,collected_at
VIETNAM_TRAVEL_b85bd43b9530,article,,,,,"Grilled Chicken with Bamboo-Tube Rice 

No culinary guide to Gia Lai would be complete without grilled chicken served with bamboo-tube rice. This iconic regional dish is a firm favourite among visitors.","Gia Lai Travel Guide: A Culinary Journey From sea breezes of Binh Dinh carrying a hint of salt to the earthy breath of the great highlands, Gia Lai’s post-merger cuisine is a captivating journey of harmony between coast and mountain. Grilled Chicken with Bamboo-Tube Rice No culinary guide to Gia Lai would be complete without grilled chicken served with bamboo-tube rice. This iconic regional dish is a firm favourite among visitors. The chicken is flavourful, lean, and pleasantly firm, grilled over charcoal to achieve a smoky aroma. It is paired with fragrant, sticky rice cooked in bamboo tubes and typically enjoyed with a dipping salt made from peanuts and sesame. The combination offers a truly memorable dining experience. Two-Bowl Pho A visit to this highland region would be incomplete without trying its famous “two-bowl pho”. As the name suggests, the dish is served in two separate bowls: one for the noodles and one for the broth. Gia Lai’s dry pho features a light, subtly sweet broth with minimal seasoning, allowing the natural flavours to shine. The noodles are ivory-white rather than translucent, with a pleasantly chewy texture. Toppings commonly include fried shallots, minced pork, beef or chicken, crispy pork fat, bean sprouts, basil, and a distinctive local dark sauce, creating a unique and satisfying dish. Sun-Dried Beef Krông Pa in Gia Lai, is well known for its cattle farming, and its sun-dried beef is a celebrated speciality. The beef, typically sourced from cattle aged between five and seven years, is prized for its natural sweetness and tenderness. After being cleaned and marinated with spices, the meat is dried under the intense highland sun. When served, it is grilled over charcoal, pounded to loosen the fibres, and enjoyed with salt, lime pepper, chilli sauce, or the region’s distinctive yellow ant salt. Fermented Crab Noodle Soup Despite its unusual name, this dish is a must-try for adventurous food lovers. Locally known as bún mắm cua , it is famous for its strong aroma derived from fermented freshwater crab paste. The broth is rich and distinctive, combined with rice noodles, crispy pork skin, prawn crackers, pork belly, and Vietnamese pork rolls. The result is a bold and unforgettable flavour profile that intrigues many visitors. Pleiku Coffee Gia Lai is one of Vietnam’s leading coffee-producing regions, making Pleiku coffee highly regarded nationwide. Travellers can enjoy rich, aromatic local brews in long-established cafés. Each offers a unique atmosphere alongside robust, high-quality coffee. Sizzling Pancakes with Fresh Prawn Originating from the coastal “Xứ Nẫu” region, this dish offers a distinctive culinary experience. The name refers to the fresh shrimp that seem to “jump” on the hot pan as they are cooked. Unlike other versions, these pancakes use small freshwater shrimp from Binh Dinh, known for their natural sweetness and firm texture. Combined with crispy batter, they create an irresistible dish. Variations with squid or beef are also popular. Fine Rice Vermicelli with Pork Offal This dish features delicate, finely woven rice vermicelli brushed with scallion oil. It is typically served with an assortment of pork offal, including heart, liver, and intestines, accompanied by fresh herbs and chilli fish sauce. Locals often pair it with a side of porridge cooked with blood pudding and minced pork, creating a rich, comforting combination of flavours and textures. Black Sesame Leaf Dumplings A well-loved speciality of the region, these dumplings are made from glutinous rice flour mixed with lá gai leaves, giving them their distinctive black colour and subtle herbal aroma. The filling, usually a blend of coconut and mung bean, provides a sweet contrast to the chewy outer layer, making it a memorable treat. Pink Coconut Cake (Rose cake) Made from simple ingredients such as glutinous rice, sugar, and fresh coconut, this traditional sweet is known for its lightly chewy texture and delicate sweetness. Once reserved for weddings and engagements, it is now widely enjoyed as a refined snack, particularly when paired with tea. Seafood Delights Following the regional merger, Gia Lai’s culinary landscape now extends beyond the highlands to include coastal specialities. Visitors can savour fresh seafood such as lobster, crab, squid, and a variety of shellfish. The best places to enjoy seafood are in Quy Nhon and surrounding coastal areas, including fishing villages and markets such as Ham Tu Port, Dam Market, and Khu 2 Market. read more Visit Vietnam Year - Gia Lai 2026: Mountains embrace the Sea Binh Dinh: Where the Surf meets the Soul You are here: Home Things to do Gia Lai Travel Guide: A Culinary Journey × Close Create an account × Close Sign in × Close Forgot Password × Close oops The entered email has subscribed for Vietnam Tourism monthly newsletter",https://vietnam.travel/things-to-do/gia-lai-travel-guide-culinary-journey,,2026-07-19T08:46:08.068956+00:00
VIETNAM_TRAVEL_f48463e72bce,article,,,,,"Each colour carries its own significance: red represents good fortune, positive energy, and strength; yellow symbolizes wealth, prosperity, and abundance; green signifies freshness, hope, and life; purple stands for loyalty, affection, and gratitude; while white embodies purity, clarity, and new beginnings.","Five-colour sticky rice, the quintessence of Vietnamese cuisine Xôi ngũ sắc is deeply rooted in the beliefs and customs of the ethnic groups in the northern mountainous regions. The term ""ngũ sắc"" refers to the five colours of the sticky rice, which symbolize the five elements: metal, wood, water, fire, and earth, reflecting the harmony of the universe and a desire for a balanced and peaceful life. Each colour carries its own significance: red represents good fortune, positive energy, and strength; yellow symbolizes wealth, prosperity, and abundance; green signifies freshness, hope, and life; purple stands for loyalty, affection, and gratitude; while white embodies purity, clarity, and new beginnings. Xôi ngũ sắc serves as a symbol of unity, abundance, and luck. It is commonly prepared during festive occasions, showcasing people's gratitude towards nature, the heavens, and ancestors, as well as the respect and hospitality of the hosts. During celebrations, the rich aroma of xôi ngũ sắc mingles with the scents of various forest leaves, creating an inviting atmosphere. The sticky rice is steamed in large wooden containers placed over glowing fires, contributing to a warm and joyful setting. The primary ingredient for xôi ngũ sắc is either glutinous rice known as ""nếp cái hoa vàng"" or ""nếp ngỗng."" To achieve natural colours, different plants, roots, and fruits are utilized. Typically served hot, it can be enjoyed with sesame salt, Vietnamese pork sausage, or other side dishes. In contemporary times, xôi ngũ sắc features not only the traditional five colours but also a variety of additional hues. Moreover, there are numerous creative variations of xôi ngũ sắc that incorporate different ingredients and spices, resulting in unique and enticing culinary delights. read more Local unpacked: One of a kind cuisine of Ha Giang karst plateau A foodie guide to Vietnam's noodles Beautiful train route to the paradise of typical cuisine in Hai Phong You are here: Home Things to do Five-colour sticky rice, the quintessence of Vietnamese cuisine × Close Create an account × Close Sign in × Close Forgot Password × Close oops The entered email has subscribed for Vietnam Tourism monthly newsletter",https://vietnam.travel/things-to-do/five-colour-sticky-rice-quintessence-vietnamese-cuisine,,2026-07-19T08:46:10.411105+00:00
VIETNAM_TRAVEL_deaffe66e79a,article,,,,,"The refreshing climate of the Central Highlands

Gia Lai's primary geographic advantage is its elevated topography, which ensures significantly cooler temperatures than the coastal plains throughout the summer. The air remains crisp and thin, frequently swept by mountain breezes that carry the earthy scent of red basalt soil and expansive pine forests.","Gia Lai: Chasing cool breezes and ancient culture Positioned on a majestic plateau averaging 700 to 800 metres above sea level, Gia Lai stands out as a destination of raw, untamed geography, refreshing mountain microclimates, and deep cultural antiquity. This enduring allure takes centre stage as the province proudly anchors the regional celebrations for Visit Vietnam Year 2026, inviting international travellers to uncover the country's most authentic highland secrets. Far from the urban bustle, this province provides an ideal summer retreat where nature and age-old traditions coexist in perfect harmony. The refreshing climate of the Central Highlands Gia Lai's primary geographic advantage is its elevated topography, which ensures significantly cooler temperatures than the coastal plains throughout the summer. The air remains crisp and thin, frequently swept by mountain breezes that carry the earthy scent of red basalt soil and expansive pine forests. Pleiku serves as the gateway to this climatic sanctuary. Visitors can escape the heat beneath the dense canopy of ancient pine forests that line the approaches to the city, creating an immediate sense of tranquil isolation. En Waterfall (Photo: Phan Thi Khanh) Epic natural landscapes The volcanic history of Gia Lai has sculpted a dramatic landscape featuring crater lakes, rugged mountains, and powerful waterfalls. T’Nung Lake (Bien Ho): Known poetically as the ""Eye of Pleiku"", this oval-shaped body of water is an extinct volcanic crater. Surrounded by pine-covered hills, its clear, deep blue waters mirror the highland sky, offering an oasis of absolute calm. Chu Dang Ya Volcano: Located further into the countryside, this dormant volcano is a striking geographical landmark. While famous for its wild sunflowers in winter, its fertile crater slopes are transformed in summer into a lush, multi-hued patchwork of local agricultural crops. Phu Cuong Waterfall: Tumbling over a sheer basalt cliff amidst a pristine forested valley, this thunderous waterfall creates a dramatic mist that instantly cools the surrounding air, making it a spectacular sight during the summer rains. Chu Dang Ya Volcano (Photo: Thaibana.vn@gmail.com) Ancient heritage and indigenous culture Beyond its natural assets, Gia Lai boasts an ancient cultural landscape rooted in the heritage of its indigenous ethnic communities, primarily the Jrai and Bahnar peoples. The communal spirit of the Rong House The architectural and social focal point of any traditional village is the Rong House. These soaring structures, with their steeply pitched, axe-blade-shaped thatched roofs, serve as the venue for village councils, sacred rituals, and community festivals. Space of Gong Culture Gia Lai is a vital custodian of the Space of Gong Culture , Masterpieces of the Oral and Intangible Heritage of Humanity. In the quiet summer evenings, the resonant, polyphonic tones of bronze gongs echo through the villages, accompanying traditional dances that have remained unchanged for generations. Photo: Nguyen Hung Quan Practical Travel Metrics Aspect Travel Details Accessibility Pleiku Airport connects directly to major hubs including Hanoi and Ho Chi Minh City, making the highlands easily accessible. Summer Attributes Average temperatures range from 20°C to 30°C, offering visitors a comfortable and pleasant climate throughout the year. Local Gastronomy Notable for its unique dry pho (Pho Hai To - Two Bowls Pho Noodle Soup), grilled chicken cooked in bamboo tubes (Ga Nuong Com Lam), and premium highland coffee. read more Gia Lai: A Hidden Highland Gem Gia Lai: The Symphony of mountains and sea Gia Lai Travel Guide: A Culinary Journey You are here: Home Things to do Gia Lai: Chasing cool breezes and ancient culture × Close Create an account × Close Sign in × Close Forgot Password × Close oops The entered email has subscribed for Vietnam Tourism monthly newsletter",https://vietnam.travel/things-to-do/gia-lai-chasing-cool-breezes-and-ancient-culture,,2026-07-19T08:46:12.763217+00:00
VIETNAM_TRAVEL_5990d02f8c29,article,,,,,"For the longest time, this frontier province was a whisper among hard-core adventurers and motorcycle purists. Ha Giang isn’t just a destination; it’s a living, breathing green maze that promises to rewrite your travel bucket list.
Photo: Thanhld67","Ha Giang Loop: Where nature and culture come in one Few places in Southeast Asia capture the spirit of discovery quite like Ha Giang. Incorporated into the newly expanded Tuyen Quang Province, this mountainous northern region is defined by towering karst peaks, winding mountain passes and centuries-old ethnic traditions, offering travellers a rare encounter with a Vietnam that feels both timeless and profoundly alive. For the longest time, this frontier province was a whisper among hard-core adventurers and motorcycle purists. Ha Giang isn’t just a destination; it’s a living, breathing green maze that promises to rewrite your travel bucket list. Photo: Thanhld67 The loop of a lifetime If you’ve got a pulse and a sense of adventure, the Ha Giang Loop is your calling card. This isn’t a leisurely Sunday drive; it’s a multi-day, adrenaline-pumping rollercoaster carved right into the limestone mountains. As you navigate the legendary hairpin turns, you’ll find yourself swallowed by the ""Green Maze"", a dizzying labyrinth of towering karst peaks, emerald-tinted valleys, and cornfields clinging precariously to vertical cliffs. Just when you think your eyes can't possibly take in any more grandeur, you hit the Ma Pi Leng Pass. Peering down at the Nho Que River, winding like a tiny turquoise ribbon thousands of feet below, is a genuine ""pinch-me"" moment. Nho Que river scenery from Ma Pi Leng Pass (Photo: Tran Van Tranh) Notice tip: Don’t ride by yourself, you should better get a local driver to ride you through these roads, to fully enjoy your trip and above all, for your safety. Culture in full technicolour Yet, to describe Ha Giang merely by its topography would be doing it a massive disservice. The true magic lies in its tapestry of cultures. The region is home to a brilliant mosaic of ethnic minority communities, including the Hmong, Tay, and Dao peoples. The Sunday Markets: If you’re lucky enough to be in Dong Van or Meo Vac on a Sunday, you’re in for a treat. The towns erupt into a riot of colour as locals from surrounding villages gather to trade, gossip, and laugh. It’s a sensory overload in the best possible way: vibrant traditional dress, the sizzle of local delicacies, and an infectious energy that no tourist resort could ever replicate. The Hospitality: Expect to be greeted with wide smiles, waves from local children, and perhaps a cheeky shot of corn wine from a friendly host. It’s heartwarming, authentic hospitality at its finest. Getting lost and chill in the maze What makes Ha Giang so endlessly enchanting is its ability to make you feel like an explorer rather than a tourist. Turn off the main track, and you might find yourself wandering through the ancient, earth-walled homes of Lao Sa village, or standing amidst a sea of pink buckwheat flowers blanketing the valleys. Visiting Ha Giang in June introduces you to a highly dramatic, cinematic landscape. This is the start of the summer wet season, meaning the region trades its dry winter haze for vibrant, hyper-saturated greens, roaring waterfalls, and a fascinating agricultural event known as the ""flooded season."" While afternoon downpours are common, traveling early in the day rewards you with clear skies and misty mountain valleys. If you are planning a June trip, these specific destinations display the very best of Ha Giang's summer charm. Hoang Su Phi rice terraces Hoang Su Phi rice terraces is an unmissable mountain terrace destination, famous for its dramatic ""mirror of the sky"" phenomenon during June. This is the crucial irrigation period when local ethnic minority farmers channel water from mountain peaks down to flood the fields for the new rice crop. From any high vantage point, the cascading mud-and-water steps completely lose their typical dry appearance and turn into massive, shimmering mirrors reflecting the dramatic summer clouds. The freshly flooded paddies act as brilliant natural mirrors, creating incredible photography opportunities when the midday sun breaks through the clouds. Visitors can witness the traditional farming methods of the Dao, Nung, and La Chi peoples working the land as the planting season kicks into gear. The valleys surrounding the terraces turn an intense, deep green that you simply will not see during the drier autumn or winter months. Photo: Tran Manh Cuong Nho Que river Nho Que is a breathtaking, turquoise-blue river cutting through Tu San Canyon, the deepest gorge in Southeast Asia. June is a magnificent time to visit because the early monsoon rains fill the river to its maximum volume, making a boat cruise or a kayak tour feel incredibly majestic. Nestled right beneath the towering rock walls of the Ma Pi Leng Pass, the river canyon traps a beautiful layer of low-hanging morning mist before the summer sun warms up the valley. Full waterways: Unlike the shallower winter months, the summer rains keep the river deep, swift, and running a rich, vibrant color. Dramatic canyon views: Gliding between the 800-metre-high vertical cliffs offers a cool, breezy escape from the humid summer heat experienced up on the roads. Atmospheric photography: The pairing of sudden sunbeams with lingering post-shower mist makes the canyon look like a scene straight out of a fantasy film. Nho Que river (Photo: tuyetmaivtv99) Du Gia waterfall Du Gia is a pristine, lively waterfall tucked away in the lush valley of Du Gia village. In the dry season, many of Ha Giang's streams shrink to a trickle, but June breathes full life into this cascade, transforming it into a powerful, roaring twin-stream waterfall. It is widely considered one of the ultimate summer rewards on the loop, providing a completely natural, refreshing swimming pool right at its base. In the summer, the waterfall is a cold, crystal-clear mountain water collects in a deep basin perfect for a swim after a hot morning of riding. Visiting in June means you get to experience the lively atmosphere of the valley homestays with far fewer crowds than during the autumn peak. Yen Minh Pine Forests Yen Minh Pine Forests is a peaceful, refreshing woodland escape running right alongside the winding QL4C highway. June brings out the absolute best in this pine escape, as the regular rains cause new needles to unfurl and fill the air with a crisp, earthy pine fragrance. It serves as a fantastic, shaded rest stop to pull over, cool down, and stretch your legs away from the exposed, sun-drenched mountain passes. Brief afternoon showers frequently roll through the trees, turning the entire green landscape incredibly moody, misty, and peaceful. The thick pine canopy and high altitude offer a notable drop in temperature compared to the humid lower valleys. Ha Giang is proof that the world still holds untamed, unspoken magic. It’s wild, it’s wondrous, and it’s waiting to amaze you. read more The Ha Giang loop: a four-day road trip The Buckwheat Bounty of Ha Giang Local unpacked: One of a kind cuisine of Ha Giang karst plateau You are here: Home Things to do Ha Giang Loop: Where nature and culture come in one × Close Create an account × Close Sign in × Close Forgot Password × Close oops The entered email has subscribed for Vietnam Tourism monthly newsletter",https://vietnam.travel/things-to-do/ha-giang-loop-where-nature-and-culture-come-one,,2026-07-19T08:46:15.118317+00:00
VIETNAM_TRAVEL_beb84f551122,article,,,,,"Photo: Nguyen Duc Tuan

A cool refuge and verdant ecosystems","Moc Chau: A green and peaceful summer oasis near Hanoi As summer heat intensifies, the Moc Chau Plateau in Son La Province emerges as an ethereal escape, a verdant heaven defined by its crisp air, sweeping landscapes, and untamed beauty. Perched at an average elevation of over 1,050 metres above sea level, this highland region boasts a rare temperate microclimate, making it a peerless destination for those seeking a tranquil retreat amidst the grandeur of the Northwest. Photo: Nguyen Duc Tuan A cool refuge and verdant ecosystems The defining strength of Moc Chau is its perpetually cool, temperate climate. Whilst the lowlands may swelter, the plateau remains pleasantly refreshed by mountain breezes and the soft, lingering mists that cloak the hills at daybreak. This unique environment nurtures a landscape of exceptional vitality. The plateau is famously blanketed in vast, undulating tea plantations, meticulously manicured into sweeping emerald waves that catch the morning light. Complementing this verdant backdrop are the renowned plum valleys, such as Na Ka and Mu Nau. During the summer months, the orchards heave with ripe, succulent plums, offering travellers the immersive experience of picking fresh fruit directly from the branches. The tea hills are not merely an economic asset but a visual masterpiece, where the rows of tea bushes curve organically across the hillsides, exuding a fresh, clean aroma. Photo: Vu Duc Hai Natural wonders and epic vistas Moc Chau is home to a diverse array of natural attractions, ranging from invigorating waterfalls to dramatic mountain peaks that command the horizon. The waterfalls of Dai Yem, Nam Pan and Chieng Khoa are reminiscent of silken ribbons tumbling over limestone cliffs. Hidden amidst ancient forests, they provide an atmosphere of total serenity and refreshment. Hailed as the ""roof of Moc Chau"", this formidable peak represents the spirit of adventure. Its massive, layered rock formations, perched above a sea of clouds, offer unparalleled panoramic views towards the border, a sight that rewards those who seek to conquer the heights. Photo: Do Truong Vinh Modern engineering meets nature The integration of world-class glass bridges provides a daring, contemporary perspective, allowing visitors to walk suspended above the canopy, capturing the full magnitude of the rugged Northwest terrain beneath their feet. A tapestry of indigenous culture The soul of Moc Chau is found in the deep-rooted traditions of the Hmong, Thai, and Dao ethnic communities. Their presence adds a vibrant layer of cultural richness to the plateau. Traditional wooden homes nestled against the hillsides and the intricate, hand-woven textiles worn by the locals are testaments to a storied heritage. Visitors are consistently moved by the sincere, unpretentious hospitality of the locals, evident in the warmth of a welcome, the sharing of traditional corn wine, and the rich flavours of local specialities such as be chao (flash-fried veal), charcoal-grilled stream fish, and colourful five-grain sticky rice. Photo: Do Truong Vinh Traveller’s essentials Feature Details Accessibility Well-connected by road, with infrastructure improvements ensuring a comfortable journey to the plateau. Accommodation A robust selection ranging from authentic homestays showcasing local architecture to luxury resorts and sophisticated glamping sites nestled in nature. Local Produce Renowned for high-quality fresh dairy products, premium Oolong tea, and seasonal temperate fruits. A commitment to sustainable growth Moc Chau is currently undergoing a dynamic transformation, yet it remains steadfast in its core mission: to balance modern development with the preservation of its natural environment and indigenous culture. By harmonising contemporary infrastructure with the raw, inherent beauty of the plateau, Moc Chau continues to establish itself as a premier, sustainable destination, one that captivates the spirit of every traveller who traverses its rolling hills. read more Why Moc Chau is every eco-traveller’s dream destination Moc Chau: Your One-Stop Nature Escape You are here: Home Things to do Moc Chau: A green and peaceful summer oasis near Hanoi × Close Create an account × Close Sign in × Close Forgot Password × Close oops The entered email has subscribed for Vietnam Tourism monthly newsletter",https://vietnam.travel/things-to-do/moc-chau-green-and-peaceful-summer-oasis-near-hanoi,,2026-07-19T08:46:17.454415+00:00
VIETNAM_TRAVEL_da3d83bf55c8,article,,,,,,"[Infographic] Visa exemption for citizens of Poland, Czech and Switzerland Below is the infographic on the visa exemption policy for citizens of Poland, Czech Republic and Switzerland traveling on tours to Viet Nam, according to Resolution 11/NQ-CP effective from 1 st March 2025 to 31 st December 2025. read more Big News! Vietnam approves extending e-visas to 90 days Vietnam issues e-visas to citizens of all countries/territories 13 coutries with visa exemption can stay in Vietnam up to 45 days HOT NEWS: Visa exemption for Polish, Czech and Swiss citizens You are here: Home Things to do [Infographic] Visa exemption for citizens of Poland, Czech and Switzerland × Close Create an account × Close Sign in × Close Forgot Password × Close oops The entered email has subscribed for Vietnam Tourism monthly newsletter",https://vietnam.travel/things-to-do/infographic-visa-exemption-citizens-poland-czech-and-switzerland,,2026-07-19T08:46:19.795222+00:00
