article_id,content_type,title,published_date,published_year,published_month,excerpt,article_text,source_url,image_url,collected_at
VIETNAM_TRAVEL_5efba4ab84ee,article,,,,,"Vietnam loves a celebration! Find out dates for Vietnamese traditional festivals, marathons, public holidays and more with this list.","Top 10 festivals & holidays in Vietnam All photography by Christian Berg Vietnam’s festivals and holidays are colorful experiences, often showcasing national heritage, music and dance performances, and high-energy activities such as dragon boat races and street parades. Take part in the fun and learn about the legends that have shaped Vietnam by joining one of these celebrations during your trip. Here are the top 10 festivals to add to your Vietnam itinerary. Lunar New Year The Lunar New Year, or Tết, is Vietnam’s largest and most important festival. Emphasis is placed on family with many returning to their home town to celebrate. Yet Tết still offers plenty for travellers to enjoy throughout the country. Usually falling in January or February, Tết Eve is the most important day in the lunar calendar and the excitement is palpable! Join the fun by enjoying the outdoor flower displays and toasting midnight fireworks with locals. Tết is always held on the first day of the first month of the lunar calendar. Lim Festival A jovial celebration of spring, the Lim Festival commemorates the festival founder while highlighting the unique culture of the Red River Delta. The festival has a remarkable ritual: quan họ. Quan họ folk songs are preformed by traditionally dressed men and women who serenade each other from aboard dragon boats. Sit back and listen to their haunting voices carry across the lake. The Lim Festival is held on the 12th or 13th day of the first lunar month. TIP: If you’re in Hanoi around February, you can find the Lim Festival an hour’s drive east in Bac Ninh Province. Huế Festival & Huế Craft Village Festival The former capital of Vietnam and home of the last Vietnamese dynasty, Huế is rich in cultural heritage. The Huế Festival or Huế Craft Village Festival takes place alternately every year in April. During the Huế Festival, history comes to life in spectacular performances at the Citadel and around the city. The Huế Craft Village Festival features exhibitions of artisanal crafts that have been made in surrounding villages for centuries. Huế's annual festivals are held over a week from late April to early May. Hùng Kings Temple Festival The Hùng Kings Temple Festival commemorates the first king of Vietnam. King Vương is legendary and his origin story is celebrated every year in either April or May as a testament of Vietnam’s epic history. To join the festival, travel to the Hùng Temple in Việt Trì City, where you can witness hundreds of lanterns set aloft into the sky on the eve of the festival. The day of the festival, watch as processions of pilgrims make their way up the mountain. Hùng Kings Day is from 8th to 11th day of the third lunar month. Xến Xó Phốn Festival The beautiful valley of Mai Châu is the scene of the Xến Xó Phốn festival between April and May each year. The festival belongs to the calendars of the White Thai people, a minority group and is essentially a ritual to call for rain. This is done with a variety of songs and offerings made throughout the village. Local lore states that the bigger the festival, the heavier the rains and the more prosperous the harvest. The Xến Xó Phốn Festival takes plan in the 4th lunar month. Ghost Festival or Wandering Souls Day The Vietnamese believe that on one day in late August or early September, the spirits of ancestors return to visit their earthly homes. This moment where the spirit realm opens is at time to pay respects to the dead. The night before Wandering Souls Day families will offer prayers, flowers and fruits at the graves of their ancestors. Paper money and clothes are burned for spirits to use in the afterlife. The Ghost Festival is on the 15th day of the 7th lunar month. TIP: While practiced throughout the country, Hue’s pagodas are an atmospheric place to witness the ritual of Wandering Souls Day. Independence Day Sept. 2, 1945 was the day Ho Chi Minh declared the Independence of the Nation of Vietnam from France in Hanoi’s Ba Dinh Square. This annual celebration commemorates that historic moment with patriotic displays and flags adorning alleyways throughout Vietnam. Major cities such as Hanoi and Ho Chi Minh City hold parades during the day and light fireworks at night. Everyone is out in the streets celebrating, and travellers are welcome to enjoy the festivities too. Vietnamese Independence Day is on September 2. Mid-Autumn Festival Children are the stars of the Mid-autumn Festival as an abundance of toys, paper lanterns and masks are given out as playthings. Celebrated between September and October, this joyful day is known for its lion dances and lantern processions. Many families gather in their gardens with tea and sweets to watch the harvest moon and enjoy performances from passing dance troupes. The Mid-autumn Festival is held on the 15th day of the 8th lunar month. TIP: Hoi An’s UNESCO-listed Ancient Town is a magical place in Vietnam to mark the Mid-autumn Festival, as boats and lanterns float down the Thu Bon River. Oóc Om Bóc In early December, the Khmer living in the Mekong Delta of Vietnam stage a lively festival known as Oóc Om Bóc. Celebrated in Sóc Trăng province, where Khmer culture is everywhere, this festival offers an incredible glimpse into Vietnam’s diversity. Look out for activities thanking the moon god for the year’s harvest, as well as feasting, singing and dancing. Crowds of thousands gather for the festival’s highlight: A thrilling ‘Ngo’ boat race. Oóc Om Bóc is marked on the night of the 14th day of the 10th lunar month. New Year’s Eve Fortunately, Vietnam celebrates both the Lunar New Year and the Gregorian New Year, raising the chances for double the fun throughout the country. Despite the cultural importance of Tết, everyone is always thrilled to ring in the first day of a new calendar. For a memorable New Year’s Eve in Vietnam, head to a major city for fireworks, live concerts and streets teeming with locals in a party mood. Want more Vietnam travel ideas? Sign up for our newsletter to receive our best stories in your inbox. read more Vietnamese History: A Primer Vietnamese etiquette for travellers Weather and climate in Vietnam You are here: Home Things to do Top 10 festivals & holidays in Vietnam × Close Create an account × Close Sign in × Close Forgot Password × Close oops The entered email has subscribed for Vietnam Tourism monthly newsletter",https://vietnam.travel/things-to-do/top-festivals-vietnam,,2026-07-19T08:46:43.314237+00:00
VIETNAM_TRAVEL_5b912db798ba,article,,,,,"Get in on the merriment of Vietnam’s favourite holiday, Tết Nguyên Đán, the biggest celebration of the year. Learn more about Tet food and traditions in this story.","A traveller's guide to Tet holiday All photography by Christian Berg Lunar New Year or Tết Nguyên Đán, is Vietnam’s most significant celebration. Across Vietnam, during this time families reunite and honour their ancestors, while praying for luck, prosperity and health in the new year. The public holiday may only run for one week, but in reality, Tết celebrations last much longer. If you’re visiting Vietnam around Lunar New Year, here’s what you can expect. A new start Tết marks the first day of the Lunar New Year, and the beginning of spring in the North of Vietnam. The holiday traces back to the early days of Vietnamese settlements in the Red River Delta, when Tết meant a new cycle of wet rice cultivation. Today, the meaning of the holiday runs much deeper than its farming roots: Vietnamese culture emphasises the importance of a fortuitous fresh start, surrounded by family and loved ones. Getting ready Throughout Vietnam, preparations for Tết begin weeks in advance, as cleaning, decorating, and sprucing up is a big part of the holiday tradition. Vietnamese shop for new clothes, get haircuts, cook special dishes, buy flowers, and even wash their motorcycles. Each home and office will decorate with signs of ‘Chúc Mừng Năm Mới’, and kumquat trees or peach blossoms will be set in a place of honour. The bigger the kumquat trees, the more prosperity and health the family will receive in the new year. Streets burst with colour as these trees are transported on the back of motorbikes. In anticipation of the long holiday, a festive spirit takes hold of the country. TIP: Tết celebrations begin three days before Lunar New Year and last a few days after. Try to avoid travelling around Vietnam at this time, as transport centres will be overflowing and tickets can be sold out. In 2021, the first day of the Lunar New Year is Friday, February 12. Shopping list In the days before Tết, markets and streets are jam-packed with shoppers. Busy housewives pick up foil, paper garlands, and auspicious red and gold decorations shaped like fish, coins, firecrackers, and blossoms. Each lunar year is represented by a zodiac animal, as reflected in glossy stickers or on paper lanterns. Locals bring home stacks of red bao lì xì - lucky money envelopes - which are customarily gifted by elders to younger members of the family, or by managers to employees. It’s a sign of maturity for young Vietnamese to stop receiving lì xì and start giving it instead. Holiday cooking Food -- especially the Tết cake bánh chưng -- is an important component of the celebrations. According to folklore, the last Hùng King could not decide which of his sons would take the throne, so he held a competition to find which son could bring him the best dish in the world. One son stood out, as he presented these two savoury rice cakes representing heaven and earth. These humble dishes impressed the king who then awarded him the throne. Across Vietnam, families will sit down to a day-long feast, and present candied fruits in beautiful boxes for guests to enjoy. TIP: In Hanoi, you can buy bánh chưng at the Quốc Hương Shop on Hàng Bông Street, which has been selling these cakes for 200 years. A traditional Tết dinner is an important occasion for family members to gather and talk about the past year. Each region has its own version of the meal. In the North, nem (fried spring rolls), bánh chưng (sticky rice cake), and whole boiled chicken are some essential dishes. A Southern Tết meal is made of caramelised pork, bitter melon soup, and chicken salad, among other things. Many dishes symbolise the passing of hardship, as well as new hope for the new year. Tết in Hanoi A stroll around the Quảng Bá Flower Market near West Lake is unforgettable the week before Tết. Shoppers bundled up against the chill buy the finest pink peach boughs they can afford to bring luck in the New Year. Tết Eve is best witnessed in the alleys of the Old Quarter, where hundreds of makeshift altars appear on the curbs, set with offerings of fruit and boiled chicken. TIP: Fireworks will be lit throughout major cities of Vietnam on Tết Eve (Feb. 11, 2021), so find a place outdoors and watch the sky light up at midnight. Tết in Hồ Chí Minh City In the South, yellow ochna flowers represent the Lunar New Year. Tết in Hồ Chí Minh City is no less colourful than in the North. Nguyễn Huệ Street in District 1 hosts the country’s largest flower show. Join the throngs -- families in new clothes and young women in áo dàis wielding selfie-sticks -- in admiring the impressive floral displays. Tết tips for travellers - People from all over the country will return to their hometowns for the Tết holiday, creating heavy demand for bus, train and plane tickets, as well as hotel rooms. If you must travel during this time, try to book transportation and accommodation far in advance. - With many staff gone home to their families, businesses and restaurants typically shut for at least the first few days of Tết. Expect cities to be quiet during this time, as well as limited dining and shopping options. - The first few days of Tết are a rare chance to see Vietnam’s big cities empty of noise and traffic. Take advantage of the quiet and explore by bicycle, scooter or on foot. - You may be invited into a family’s home for Tết which is a huge honour. During Tết, it’s important not to drop by any Vietnamese home without an invitation, as the first guests of the year are specially chosen to bring good luck to each household. - Warm wishes are much appreciated around and during Tết. On the first days of the new year, smile and say “Chúc Mừng Năm Mới” (Happy New Year) to everyone you see! Want more Vietnam travel ideas? Sign up for our newsletter to receive our best stories in your inbox. read more Vietnam's magical Mid-autumn Festival Vietnamese History: A Primer Top 10 festivals & holidays in Vietnam You are here: Home Things to do Family A traveller's guide to Tet holiday × Close Create an account × Close Sign in × Close Forgot Password × Close oops The entered email has subscribed for Vietnam Tourism monthly newsletter",https://vietnam.travel/things-to-do/tet-vietnam-lunar-new-year,,2026-07-19T08:46:45.669509+00:00
VIETNAM_TRAVEL_8ff68371f9a5,destination,,,,,"Top things to do in Phu Yen

Camping on Lao Mai Nha Islet

For visitors who are up to some adventurous experience, have some camping on Lao Mai Nha Islet. This is a small islet that is just 4km away from O Loan Lagoon. Nature here remains completely untouched. The beauty of the beach and peace of nature make Lao Mai Nha islet an ideal place for camping and fish hunting on the beach.","Phu Yen Overview Gallery You may also like Nearby places When To Go How To Get There Overview Gallery You may also like Nearby places Phu Yen, dubbed the land of the rising sun, is Vietnam's easternmost province. Perched enchanting geography, fabulous culinary delights, and an abundance of thrilling activities. Plus, a quiet beach with romantic scenery, isolated islands and marvellous stone cliffs, Phu Yen is truly a precious gem in Central Vietnam. Top things to do in Phu Yen Camping on Lao Mai Nha Islet For visitors who are up to some adventurous experience, have some camping on Lao Mai Nha Islet. This is a small islet that is just 4km away from O Loan Lagoon. Nature here remains completely untouched. The beauty of the beach and peace of nature make Lao Mai Nha islet an ideal place for camping and fish hunting on the beach. Sailing, kayaking and swimming Phu Yen boasts a bunch of beautiful beaches. Enjoy the cool and clear water here or engage yourself in several water sport activities such as sailing, kayaking on small islets Lao Mai Nha or Xuan Dai Bay, and O Loan Lagoon, and even zip-lining!. Feel free to swim in mainstream beaches like Mon beach or Long Thuy beach and enjoy a spectacular sunrise swim at dawn. Hiking Nhan Mountain Phu Yen not only offers charming, relaxing beaches but also majestic mountains. Nhan Mountain is the most famous place for hiking, attracting a myriad number of domestic and international travellers every year. With Nhan Tower on the top and stunning scenery of wild nature, all the climbs are worth it. Biking or driving on coastal highway Phu Yen can be called a great place full of sunshine to enjoy outdoor activities. With the fabulous terrain, visitors can feel free to discover Phu Yen’s picturesque coastal highway, enjoy the panoramic views from the top of the mountain, or have some party on the private boat while enjoying the fresh scene of the bays. Phu Yen Weather Phu Yen is a beach-front land with the typical features of tropical weather, so you can visit this land of yellow flowers at any time. Avoid the storm season which takes place from September to December every year. Phu Yen Transport Tuy Hoa Airport is only 10 km away from the city centre and there are several flights from major cities like Ha Noi and Ho Chi Minh City to this airport a day. On the other hand, visitors can choose to go to Phu Yen by train and enjoy amazing sceneries along the trips. Gallery You may also like Phu Yen: Undiscovered Nature and Remote Culture Nearby places Nha Trang Da Lat Da Nang You are here: Home Places To Go Central Vietnam Phu Yen × Close Create an account × Close Sign in × Close Forgot Password × Close oops The entered email has subscribed for Vietnam Tourism monthly newsletter",https://vietnam.travel/places-to-go/central-vietnam/phu-yen,,2026-07-19T08:59:09.794569+00:00
VIETNAM_TRAVEL_947503157206,article,,,,,"Nam Quan is a photographer and fashion designer who grew up amid the bright lights and changing cityscape of Ho Chi Minh City. When he’s not working or catching up with his posse of friends he spends a lot of time on his motorbike, and knows where to go for the city’s best food, coffee and nightlife. Here Nam gives an inside look into Vietnam’s fast-growing metropolis. 

What are your favourite ‘secret' spots in Ho Chi Minh City?","My HCMC with Nam Nam Quan is a photographer and fashion designer who grew up amid the bright lights and changing cityscape of Ho Chi Minh City . When he’s not working or catching up with his posse of friends he spends a lot of time on his motorbike, and knows where to go for the city’s best food, coffee and nightlife. Here Nam gives an inside look into Vietnam’s fast-growing metropolis. What are your favourite ‘secret' spots in Ho Chi Minh City? I like sitting on the rooftop of Ăn Ăn Restaurant. Here you also get a skyline view of Ho Chi Minh City, but in a different way. Unlike other sight-seeing spots, the view is from behind the cityscape instead of from the front. The lights are all there but things seem more quiet. Some of my favourite hidden bars are intheMOOD and PK Maltroom. Is there a festival or special event here that travellers should not miss? Mid-autumn Festival in District 5 is super colourful and the streets are well-decorated. You can also try mooncakes during that time. Is there a lesser-known dish that you wish more people knew about? Khổ qua cà ớt, fish cake stuffed inside bitter melon, with eggplant, tomato and chillies. You can only find this in District 5. Where is your favourite coffee shop here and what do you like about it? La Viet coffee has a great vibe and nice coffee in a reasonable price range. Speciality cafes have been a massive trend here in Ho Chi Minh City, but La Viet is one of the best. If you had to describe Ho Chi Minh City in three adjectives, what would they be and why? Colourful. Noisy. Friendly. What are the people of Ho Chi Minh City like? People here are friendly, warm-hearted & welcome all sorts of new things and new culture. My HCMC from Vietnam Tourism Board on Vimeo . What’s some advice you’d give to travellers? Bargaining is something you should do when shopping, but if you're the first customer of the day and you don’t close the deal after bargaining, it's considered bad luck for shop owners, and they'll be unhappy about it. So I would recommend doing your shopping and your bargaining in the afternoon. What makes Ho Chi Minh City different from other places in Vietnam? Ho Chi Minh City is very active, in terms of culture and economy. You’ll see new businesses up and running every day, new trends and concepts are adapted week by week. People here are eager to learn and absorb, to develop new things. Where should travellers go to see the best views of the city? You’ll find great views on the other side of the river from the roof of Thu Thiem Tunnel or from the top of Thu Thiem Bridge, looking back to the cityscape of District 1. Bitexco Skydeck is also a good spot right in the heart of the city. Continue your journey through #MyVietnam with insightful local interviews, videos and travel tips here . read more The perfect weekend in HCMC How to see HCMC like a local 7 outstanding tours of HCMC You are here: Home Things to do My HCMC with Nam × Close Create an account × Close Sign in × Close Forgot Password × Close oops The entered email has subscribed for Vietnam Tourism monthly newsletter",https://vietnam.travel/things-to-do/my-hcmc-nam,,2026-07-19T08:59:31.515876+00:00
